tcpdump: verbose output suppressed, use -v or -vv for full protocol decode
listening on eth0, link-type EN10MB (Ethernet), capture size 262144 bytes

2022-09-06 08:57:50.028704 IP 10.32.142.236.38566 > 192.168.103.137.7000: Flags [S], seq 2143061275, win 29200, options [mss 1460,sackOK,TS val 2559443925 ecr 0,nop,wscale 9], length 0
E..<..@.@...
 ....g....X..........r..l.........
...........	
2022-09-06 08:57:50.028889 IP 192.168.103.137.7000 > 10.32.142.236.38566: Flags [S.], seq 3633796318, ack 2143061276, win 29200, options [mss 1460,nop,nop,sackOK,nop,wscale 9], length 0
E..4..@.?.z...g.
 ...X....T.......r.Wc.............	
2022-09-06 08:57:50.028924 IP 10.32.142.236.38566 > 192.168.103.137.7000: Flags [.], ack 1, win 58, length 0
E..(..@.@...
 ....g....X......T.P..:.X..
2022-09-06 08:57:50.029097 IP 10.32.142.236.38566 > 192.168.103.137.7000: Flags [P.], seq 1:421, ack 1, win 58, length 420
E.....@.@...
 ....g....X......T.P..:....POST / HTTP/1.1
Content-Length: 222
Content-Type: application/json; charset=UTF-8
Host: 192.168.103.137:7000
Connection: Keep-Alive
User-Agent: Apache-HttpAsyncClient/4.1.4 (Java/1.8.0_191)

{"methodName":"feedback","param":"{\"currentLogId\":1242886272,\"handleEndTime\":1662425870028,\"msg\":\"ok\",\"retry\":false,\"status\":\"SUCCESS\"}","parameterType":"com.ggj.platform.task.dc.core.job.model.JobRunResult"}
2022-09-06 08:57:50.029225 IP 192.168.103.137.7000 > 10.32.142.236.38566: Flags [.], ack 421, win 60, length 0
E..(.`@.?..1..g.
 ...X....T.....P..<.h..
2022-09-06 08:57:50.030757 IP 192.168.103.137.7000 > 10.32.142.236.38566: Flags [P.], seq 1:227, ack 421, win 60, length 226
E..
.a@.?..N..g.
 ...X....T.....P..<+...HTTP/1.1 200 OK
Date: Tue, 06 Sep 2022 00:57:50 GMT
Content-Type: application/json;charset=utf-8
Content-Length: 71
Server: Jetty(9.4.12.v20180830)

{"code":200,"msg":"ok","rsp":"{\"msg\":\"ok\",\"status\":\"SUCCESS\"}"}
2022-09-06 08:57:50.030784 IP 10.32.142.236.38566 > 192.168.103.137.7000: Flags [.], ack 227, win 60, length 0
E..(..@.@...
 ....g....X......U.P..<.X..
2022-09-06 08:58:00.112853 IP 10.32.142.236.45596 > 192.168.103.136.7000: Flags [S], seq 1330381142, win 29200, options [mss 1460,sackOK,TS val 2559454009 ecr 0,nop,wscale 9], length 0
E..<*o@.@.O.
 ....g....XOL.V......r..k.........
..+9.......	
2022-09-06 08:58:00.113096 IP 192.168.103.136.7000 > 10.32.142.236.45596: Flags [S.], seq 2513821949, ack 1330381143, win 29200, options [mss 1460,nop,nop,sackOK,nop,wscale 9], length 0
E..4..@.?.z...g.
 ...X......OL.W..r................	
2022-09-06 08:58:00.113117 IP 10.32.142.236.45596 > 192.168.103.136.7000: Flags [.], ack 1, win 58, length 0
E..(*p@.@.O#
 ....g....XOL.W....P..:.W..
2022-09-06 08:58:00.113310 IP 10.32.142.236.45596 > 192.168.103.136.7000: Flags [P.], seq 1:421, ack 1, win 58, length 420
E...*q@.@.M~
 ....g....XOL.W....P..:....POST / HTTP/1.1
Content-Length: 222
Content-Type: application/json; charset=UTF-8
Host: 192.168.103.136:7000
Connection: Keep-Alive
User-Agent: Apache-HttpAsyncClient/4.1.4 (Java/1.8.0_191)

{"methodName":"feedback","param":"{\"currentLogId\":1242886382,\"handleEndTime\":1662425880112,\"msg\":\"ok\",\"retry\":false,\"status\":\"SUCCESS\"}","parameterType":"com.ggj.platform.task.dc.core.job.model.JobRunResult"}
2022-09-06 08:58:00.113441 IP 192.168.103.136.7000 > 10.32.142.236.45596: Flags [.], ack 421, win 60, length 0
E..(..@.?.....g.
 ...X......OL..P..<W...
2022-09-06 08:58:00.115832 IP 192.168.103.136.7000 > 10.32.142.236.45596: Flags [P.], seq 1:227, ack 421, win 60, length 226
E..
..@.?..(..g.
 ...X......OL..P..<....HTTP/1.1 200 OK
Date: Tue, 06 Sep 2022 00:58:00 GMT
Content-Type: application/json;charset=utf-8
Content-Length: 71
Server: Jetty(9.4.12.v20180830)

{"code":200,"msg":"ok","rsp":"{\"msg\":\"ok\",\"status\":\"SUCCESS\"}"}
2022-09-06 08:58:00.115845 IP 10.32.142.236.45596 > 192.168.103.136.7000: Flags [.], ack 227, win 60, length 0
E..(*r@.@.O!
 ....g....XOL......P..<.W..
2022-09-06 08:58:00.389126 IP 10.32.142.236.45596 > 192.168.103.136.7000: Flags [P.], seq 421:841, ack 227, win 60, length 420
E...*s@.@.M|
 ....g....XOL......P..<....POST / HTTP/1.1
Content-Length: 222
Content-Type: application/json; charset=UTF-8
Host: 192.168.103.136:7000
Connection: Keep-Alive
User-Agent: Apache-HttpAsyncClient/4.1.4 (Java/1.8.0_191)

{"methodName":"feedback","param":"{\"currentLogId\":1242886424,\"handleEndTime\":1662425880384,\"msg\":\"ok\",\"retry\":false,\"status\":\"SUCCESS\"}","parameterType":"com.ggj.platform.task.dc.core.job.model.JobRunResult"}
2022-09-06 08:58:00.390938 IP 192.168.103.136.7000 > 10.32.142.236.45596: Flags [P.], seq 227:453, ack 841, win 62, length 226
E..
..@.?..'..g.
 ...X......OL..P..>|...HTTP/1.1 200 OK
Date: Tue, 06 Sep 2022 00:58:00 GMT
Content-Type: application/json;charset=utf-8
Content-Length: 71
Server: Jetty(9.4.12.v20180830)

{"code":200,"msg":"ok","rsp":"{\"msg\":\"ok\",\"status\":\"SUCCESS\"}"}
2022-09-06 08:58:00.390952 IP 10.32.142.236.45596 > 192.168.103.136.7000: Flags [.], ack 453, win 62, length 0
E..(*t@.@.O.
 ....g....XOL......P..>.W..
2022-09-06 08:58:00.483421 IP 10.32.142.236.38566 > 192.168.103.137.7000: Flags [P.], seq 421:841, ack 227, win 60, length 420
E.....@.@...
 ....g....X......U.P..<....POST / HTTP/1.1
Content-Length: 222
Content-Type: application/json; charset=UTF-8
Host: 192.168.103.137:7000
Connection: Keep-Alive
User-Agent: Apache-HttpAsyncClient/4.1.4 (Java/1.8.0_191)

{"methodName":"feedback","param":"{\"currentLogId\":1242886439,\"handleEndTime\":1662425880473,\"msg\":\"ok\",\"retry\":false,\"status\":\"SUCCESS\"}","parameterType":"com.ggj.platform.task.dc.core.job.model.JobRunResult"}
2022-09-06 08:58:00.485468 IP 192.168.103.137.7000 > 10.32.142.236.38566: Flags [P.], seq 227:453, ack 841, win 62, length 226
E..
.b@.?..M..g.
 ...X....U....dP..>-2..HTTP/1.1 200 OK
Date: Tue, 06 Sep 2022 00:58:00 GMT
Content-Type: application/json;charset=utf-8
Content-Length: 71
Server: Jetty(9.4.12.v20180830)

{"code":200,"msg":"ok","rsp":"{\"msg\":\"ok\",\"status\":\"SUCCESS\"}"}
2022-09-06 08:58:00.485486 IP 10.32.142.236.38566 > 192.168.103.137.7000: Flags [.], ack 453, win 62, length 0
E..(..@.@...
 ....g....X...d..V.P..>.X..
2022-09-06 08:58:20.031744 IP 10.32.142.236.45596 > 192.168.103.136.7000: Flags [P.], seq 841:1261, ack 453, win 62, length 420
E...*u@.@.Mz
 ....g....XOL......P..>....POST / HTTP/1.1
Content-Length: 222
Content-Type: application/json; charset=UTF-8
Host: 192.168.103.136:7000
Connection: Keep-Alive
User-Agent: Apache-HttpAsyncClient/4.1.4 (Java/1.8.0_191)

{"methodName":"feedback","param":"{\"currentLogId\":1242886694,\"handleEndTime\":1662425900031,\"msg\":\"ok\",\"retry\":false,\"status\":\"SUCCESS\"}","parameterType":"com.ggj.platform.task.dc.core.job.model.JobRunResult"}
2022-09-06 08:58:20.033692 IP 192.168.103.136.7000 > 10.32.142.236.45596: Flags [P.], seq 453:679, ack 1261, win 64, length 226
E..
..@.?..&..g.
 ...X......OL.CP..@x...HTTP/1.1 200 OK
Date: Tue, 06 Sep 2022 00:58:20 GMT
Content-Type: application/json;charset=utf-8
Content-Length: 71
Server: Jetty(9.4.12.v20180830)

{"code":200,"msg":"ok","rsp":"{\"msg\":\"ok\",\"status\":\"SUCCESS\"}"}
2022-09-06 08:58:20.033719 IP 10.32.142.236.45596 > 192.168.103.136.7000: Flags [.], ack 679, win 64, length 0
E..(*v@.@.O.
 ....g....XOL.C....P..@.W..
2022-09-06 08:58:30.485394 IP 192.168.103.137.7000 > 10.32.142.236.38566: Flags [F.], seq 453, ack 841, win 62, length 0
E..(.c@.?.....g.
 ...X....V....dP..>....
2022-09-06 08:58:30.485471 IP 10.32.142.236.38566 > 192.168.103.137.7000: Flags [F.], seq 841, ack 454, win 62, length 0
E..(..@.@...
 ....g....X...d..V.P..>.X..
2022-09-06 08:58:30.485631 IP 192.168.103.137.7000 > 10.32.142.236.38566: Flags [.], ack 842, win 62, length 0
E..(.d@.?..-..g.
 ...X....V....eP..>....
2022-09-06 08:58:40.028132 IP 10.32.142.236.45596 > 192.168.103.136.7000: Flags [P.], seq 1261:1681, ack 679, win 64, length 420
E...*w@.@.Mx
 ....g....XOL.C....P..@....POST / HTTP/1.1
Content-Length: 222
Content-Type: application/json; charset=UTF-8
Host: 192.168.103.136:7000
Connection: Keep-Alive
User-Agent: Apache-HttpAsyncClient/4.1.4 (Java/1.8.0_191)

{"methodName":"feedback","param":"{\"currentLogId\":1242886924,\"handleEndTime\":1662425920027,\"msg\":\"ok\",\"retry\":false,\"status\":\"SUCCESS\"}","parameterType":"com.ggj.platform.task.dc.core.job.model.JobRunResult"}
2022-09-06 08:58:40.029911 IP 192.168.103.136.7000 > 10.32.142.236.45596: Flags [P.], seq 679:905, ack 1681, win 66, length 226
E..
..@.?..%..g.
 ...X......OL..P..Bs...HTTP/1.1 200 OK
Date: Tue, 06 Sep 2022 00:58:40 GMT
Content-Type: application/json;charset=utf-8
Content-Length: 71
Server: Jetty(9.4.12.v20180830)

{"code":200,"msg":"ok","rsp":"{\"msg\":\"ok\",\"status\":\"SUCCESS\"}"}
2022-09-06 08:58:40.029926 IP 10.32.142.236.45596 > 192.168.103.136.7000: Flags [.], ack 905, win 66, length 0
E..(*x@.@.O.
 ....g....XOL......P..B.W..
2022-09-06 08:59:00.080977 IP 10.32.142.236.39866 > 192.168.103.137.7000: Flags [S], seq 2718705293, win 29200, options [mss 1460,sackOK,TS val 2559513977 ecr 0,nop,wscale 9], length 0
E..<3.@.@.E.
 ....g....X..&.......r..l.........
...y.......	
2022-09-06 08:59:00.081163 IP 192.168.103.137.7000 > 10.32.142.236.39866: Flags [S.], seq 257176520, ack 2718705294, win 29200, options [mss 1460,nop,nop,sackOK,nop,wscale 9], length 0
E..4..@.?.z...g.
 ...X...T3...&...r.x..............	
2022-09-06 08:59:00.081189 IP 10.32.142.236.39866 > 192.168.103.137.7000: Flags [.], ack 1, win 58, length 0
E..(3.@.@.E.
 ....g....X..&..T3.P..:.X..
2022-09-06 08:59:00.081345 IP 10.32.142.236.39866 > 192.168.103.137.7000: Flags [P.], seq 1:421, ack 1, win 58, length 420
E...3.@.@.C.
 ....g....X..&..T3.P..:....POST / HTTP/1.1
Content-Length: 222
Content-Type: application/json; charset=UTF-8
Host: 192.168.103.137:7000
Connection: Keep-Alive
User-Agent: Apache-HttpAsyncClient/4.1.4 (Java/1.8.0_191)

{"methodName":"feedback","param":"{\"currentLogId\":1242887138,\"handleEndTime\":1662425940080,\"msg\":\"ok\",\"retry\":false,\"status\":\"SUCCESS\"}","parameterType":"com.ggj.platform.task.dc.core.job.model.JobRunResult"}
2022-09-06 08:59:00.081479 IP 192.168.103.137.7000 > 10.32.142.236.39866: Flags [.], ack 421, win 60, length 0
E..(1.@.?.H...g.
 ...X...T3...(2P..<)...
2022-09-06 08:59:00.083029 IP 192.168.103.137.7000 > 10.32.142.236.39866: Flags [P.], seq 1:227, ack 421, win 60, length 226
E..
1.@.?.H...g.
 ...X...T3...(2P..<P>..HTTP/1.1 200 OK
Date: Tue, 06 Sep 2022 00:59:00 GMT
Content-Type: application/json;charset=utf-8
Content-Length: 71
Server: Jetty(9.4.12.v20180830)

{"code":200,"msg":"ok","rsp":"{\"msg\":\"ok\",\"status\":\"SUCCESS\"}"}
2022-09-06 08:59:00.083046 IP 10.32.142.236.39866 > 192.168.103.137.7000: Flags [.], ack 227, win 60, length 0
E..(3.@.@.E.
 ....g....X..(2.T4.P..<.X..
2022-09-06 08:59:10.028041 IP 10.32.142.236.45596 > 192.168.103.136.7000: Flags [P.], seq 1681:2101, ack 905, win 66, length 420
E...*y@.@.Mv
 ....g....XOL......P..B....POST / HTTP/1.1
Content-Length: 222
Content-Type: application/json; charset=UTF-8
Host: 192.168.103.136:7000
Connection: Keep-Alive
User-Agent: Apache-HttpAsyncClient/4.1.4 (Java/1.8.0_191)

{"methodName":"feedback","param":"{\"currentLogId\":1242887315,\"handleEndTime\":1662425950027,\"msg\":\"ok\",\"retry\":false,\"status\":\"SUCCESS\"}","parameterType":"com.ggj.platform.task.dc.core.job.model.JobRunResult"}
2022-09-06 08:59:10.029563 IP 192.168.103.136.7000 > 10.32.142.236.45596: Flags [P.], seq 905:1131, ack 2101, win 68, length 226
E..
..@.?..$..g.
 ...X......OL	.P..Dr...HTTP/1.1 200 OK
Date: Tue, 06 Sep 2022 00:59:10 GMT
Content-Type: application/json;charset=utf-8
Content-Length: 71
Server: Jetty(9.4.12.v20180830)

{"code":200,"msg":"ok","rsp":"{\"msg\":\"ok\",\"status\":\"SUCCESS\"}"}
2022-09-06 08:59:10.029583 IP 10.32.142.236.45596 > 192.168.103.136.7000: Flags [.], ack 1131, win 68, length 0
E..(*z@.@.O.
 ....g....XOL	....hP..D.W..
2022-09-06 08:59:20.032417 IP 10.32.142.236.45596 > 192.168.103.136.7000: Flags [P.], seq 2101:2521, ack 1131, win 68, length 420
E...*{@.@.Mt
 ....g....XOL	....hP..D....POST / HTTP/1.1
Content-Length: 222
Content-Type: application/json; charset=UTF-8
Host: 192.168.103.136:7000
Connection: Keep-Alive
User-Agent: Apache-HttpAsyncClient/4.1.4 (Java/1.8.0_191)

{"methodName":"feedback","param":"{\"currentLogId\":1242887418,\"handleEndTime\":1662425960032,\"msg\":\"ok\",\"retry\":false,\"status\":\"SUCCESS\"}","parameterType":"com.ggj.platform.task.dc.core.job.model.JobRunResult"}
2022-09-06 08:59:20.034128 IP 192.168.103.136.7000 > 10.32.142.236.45596: Flags [P.], seq 1131:1357, ack 2521, win 70, length 226
E..
..@.?..#..g.
 ...X.....hOL./P..Fou..HTTP/1.1 200 OK
Date: Tue, 06 Sep 2022 00:59:20 GMT
Content-Type: application/json;charset=utf-8
Content-Length: 71
Server: Jetty(9.4.12.v20180830)

{"code":200,"msg":"ok","rsp":"{\"msg\":\"ok\",\"status\":\"SUCCESS\"}"}
2022-09-06 08:59:20.034146 IP 10.32.142.236.45596 > 192.168.103.136.7000: Flags [.], ack 1357, win 70, length 0
E..(*|@.@.O.
 ....g....XOL./...JP..F.W..
2022-09-06 08:59:30.082612 IP 192.168.103.137.7000 > 10.32.142.236.39866: Flags [F.], seq 227, ack 421, win 60, length 0
E..(1.@.?.H...g.
 ...X...T4...(2P..<)	..
2022-09-06 08:59:30.082688 IP 10.32.142.236.39866 > 192.168.103.137.7000: Flags [F.], seq 421, ack 228, win 60, length 0
E..(3.@.@.E.
 ....g....X..(2.T4.P..<.X..
2022-09-06 08:59:30.082817 IP 192.168.103.137.7000 > 10.32.142.236.39866: Flags [.], ack 422, win 60, length 0
E..(1.@.?.H...g.
 ...X...T4...(3P..<)...
2022-09-06 08:59:50.027698 IP 10.32.142.236.40790 > 192.168.103.137.7000: Flags [S], seq 813088920, win 29200, options [mss 1460,sackOK,TS val 2559563924 ecr 0,nop,wscale 9], length 0
E..<..@.@.ar
 ....g..V.X0v........r..l.........
...........	
2022-09-06 08:59:50.027892 IP 192.168.103.137.7000 > 10.32.142.236.40790: Flags [S.], seq 3357584551, ack 813088921, win 29200, options [mss 1460,nop,nop,sackOK,nop,wscale 9], length 0
E..4..@.?.z...g.
 ...X.V. ..0v....r..*.............	
2022-09-06 08:59:50.027908 IP 10.32.142.236.40790 > 192.168.103.137.7000: Flags [.], ack 1, win 58, length 0
E..(..@.@.a.
 ....g..V.X0v... ..P..:.X..
2022-09-06 08:59:50.028165 IP 10.32.142.236.40790 > 192.168.103.137.7000: Flags [P.], seq 1:421, ack 1, win 58, length 420
E.....@.@._.
 ....g..V.X0v... ..P..:....POST / HTTP/1.1
Content-Length: 222
Content-Type: application/json; charset=UTF-8
Host: 192.168.103.137:7000
Connection: Keep-Alive
User-Agent: Apache-HttpAsyncClient/4.1.4 (Java/1.8.0_191)

{"methodName":"feedback","param":"{\"currentLogId\":1242887754,\"handleEndTime\":1662425990027,\"msg\":\"ok\",\"retry\":false,\"status\":\"SUCCESS\"}","parameterType":"com.ggj.platform.task.dc.core.job.model.JobRunResult"}
2022-09-06 08:59:50.028299 IP 192.168.103.137.7000 > 10.32.142.236.40790: Flags [.], ack 421, win 60, length 0
E..(i.@.?.....g.
 ...X.V. ..0v.=P..<....
2022-09-06 08:59:50.029916 IP 192.168.103.137.7000 > 10.32.142.236.40790: Flags [P.], seq 1:227, ack 421, win 60, length 226
E..
i.@.?.....g.
 ...X.V. ..0v.=P..<....HTTP/1.1 200 OK
Date: Tue, 06 Sep 2022 00:59:50 GMT
Content-Type: application/json;charset=utf-8
Content-Length: 71
Server: Jetty(9.4.12.v20180830)

{"code":200,"msg":"ok","rsp":"{\"msg\":\"ok\",\"status\":\"SUCCESS\"}"}
2022-09-06 08:59:50.029928 IP 10.32.142.236.40790 > 192.168.103.137.7000: Flags [.], ack 227, win 60, length 0
E..(..@.@.a.
 ....g..V.X0v.=. ..P..<.X..
2022-09-06 08:59:50.033811 IP 192.168.103.136.7000 > 10.32.142.236.45596: Flags [F.], seq 1357, ack 2521, win 70, length 0
E..(..@.?.....g.
 ...X.....JOL./P..FJ@..
2022-09-06 08:59:50.033866 IP 10.32.142.236.45596 > 192.168.103.136.7000: Flags [F.], seq 2521, ack 1358, win 70, length 0
E..(*}@.@.O.
 ....g....XOL./...KP..F.W..
2022-09-06 08:59:50.034006 IP 192.168.103.136.7000 > 10.32.142.236.45596: Flags [.], ack 2522, win 70, length 0
E..(..@.?.....g.
 ...X.....KOL.0P..FJ?..
2022-09-06 09:00:01.681251 IP 10.32.142.236.47878 > 192.168.103.136.7000: Flags [S], seq 2246902322, win 29200, options [mss 1460,sackOK,TS val 2559575578 ecr 0,nop,wscale 9], length 0
E..<.(@.@.uW
 ....g....X...2......r..k.........
...........	
2022-09-06 09:00:01.681470 IP 192.168.103.136.7000 > 10.32.142.236.47878: Flags [S.], seq 3040817427, ack 2246902323, win 29200, options [mss 1460,nop,nop,sackOK,nop,wscale 9], length 0
E..4..@.?.z...g.
 ...X...?1....3..r................	
2022-09-06 09:00:01.681489 IP 10.32.142.236.47878 > 192.168.103.136.7000: Flags [.], ack 1, win 58, length 0
E..(.)@.@.uj
 ....g....X...3.?1.P..:.W..
2022-09-06 09:00:01.681660 IP 10.32.142.236.47878 > 192.168.103.136.7000: Flags [P.], seq 1:421, ack 1, win 58, length 420
E....*@.@.s.
 ....g....X...3.?1.P..:....POST / HTTP/1.1
Content-Length: 222
Content-Type: application/json; charset=UTF-8
Host: 192.168.103.136:7000
Connection: Keep-Alive
User-Agent: Apache-HttpAsyncClient/4.1.4 (Java/1.8.0_191)

{"methodName":"feedback","param":"{\"currentLogId\":1242888106,\"handleEndTime\":1662426001680,\"msg\":\"ok\",\"retry\":false,\"status\":\"SUCCESS\"}","parameterType":"com.ggj.platform.task.dc.core.job.model.JobRunResult"}
2022-09-06 09:00:01.681810 IP 192.168.103.136.7000 > 10.32.142.236.47878: Flags [.], ack 421, win 60, length 0
E..(0M@.?.JF..g.
 ...X...?1.....P..<....
2022-09-06 09:00:01.683472 IP 192.168.103.136.7000 > 10.32.142.236.47878: Flags [P.], seq 1:227, ack 421, win 60, length 226
E..
0N@.?.Ic..g.
 ...X...?1.....P..<.9..HTTP/1.1 200 OK
Date: Tue, 06 Sep 2022 01:00:01 GMT
Content-Type: application/json;charset=utf-8
Content-Length: 71
Server: Jetty(9.4.12.v20180830)

{"code":200,"msg":"ok","rsp":"{\"msg\":\"ok\",\"status\":\"SUCCESS\"}"}
2022-09-06 09:00:01.683484 IP 10.32.142.236.47878 > 192.168.103.136.7000: Flags [.], ack 227, win 60, length 0
E..(.+@.@.uh
 ....g....X.....?1.P..<.W..
2022-09-06 09:00:20.029410 IP 192.168.103.137.7000 > 10.32.142.236.40790: Flags [F.], seq 227, ack 421, win 60, length 0
E..(i.@.?.....g.
 ...X.V. ..0v.=P..<.K..
2022-09-06 09:00:20.029473 IP 10.32.142.236.40790 > 192.168.103.137.7000: Flags [F.], seq 421, ack 228, win 60, length 0
E..(..@.@.a.
 ....g..V.X0v.=. ..P..<.X..
2022-09-06 09:00:20.029608 IP 192.168.103.137.7000 > 10.32.142.236.40790: Flags [.], ack 422, win 60, length 0
E..(i.@.?.....g.
 ...X.V. ..0v.>P..<.J..
2022-09-06 09:00:31.683953 IP 192.168.103.136.7000 > 10.32.142.236.47878: Flags [F.], seq 227, ack 421, win 60, length 0
E..(0O@.?.JD..g.
 ...X...?1.....P..<....
2022-09-06 09:00:31.684027 IP 10.32.142.236.47878 > 192.168.103.136.7000: Flags [F.], seq 421, ack 228, win 60, length 0
E..(.,@.@.ug
 ....g....X.....?1.P..<.W..
2022-09-06 09:00:31.684170 IP 192.168.103.136.7000 > 10.32.142.236.47878: Flags [.], ack 422, win 60, length 0
E..(0P@.?.JC..g.
 ...X...?1.....P..<....
2022-09-06 09:00:50.066711 IP 10.32.142.236.49120 > 192.168.103.136.7000: Flags [S], seq 3760018047, win 29200, options [mss 1460,sackOK,TS val 2559623963 ecr 0,nop,wscale 9], length 0
E..<.d@.@...
 ....g....X..R.......r..k.........
...........	
2022-09-06 09:00:50.066944 IP 192.168.103.136.7000 > 10.32.142.236.49120: Flags [S.], seq 1704859747, ack 3760018048, win 29200, options [mss 1460,nop,nop,sackOK,nop,wscale 9], length 0
E..4..@.?.z...g.
 ...X..e..c..R...r................	
2022-09-06 09:00:50.066965 IP 10.32.142.236.49120 > 192.168.103.136.7000: Flags [.], ack 1, win 58, length 0
E..(.e@.@..-
 ....g....X..R.e..dP..:.W..
2022-09-06 09:00:50.074657 IP 10.32.142.236.49120 > 192.168.103.136.7000: Flags [P.], seq 1:421, ack 1, win 58, length 420
E....f@.@...
 ....g....X..R.e..dP..:....POST / HTTP/1.1
Content-Length: 222
Content-Type: application/json; charset=UTF-8
Host: 192.168.103.136:7000
Connection: Keep-Alive
User-Agent: Apache-HttpAsyncClient/4.1.4 (Java/1.8.0_191)

{"methodName":"feedback","param":"{\"currentLogId\":1242888649,\"handleEndTime\":1662426050066,\"msg\":\"ok\",\"retry\":false,\"status\":\"SUCCESS\"}","parameterType":"com.ggj.platform.task.dc.core.job.model.JobRunResult"}
2022-09-06 09:00:50.074908 IP 192.168.103.136.7000 > 10.32.142.236.49120: Flags [.], ack 421, win 60, length 0
E..(.?@.?..S..g.
 ...X..e..d..T$P..<`...
2022-09-06 09:00:50.076389 IP 192.168.103.136.7000 > 10.32.142.236.49120: Flags [P.], seq 1:227, ack 421, win 60, length 226
E..
.@@.?..p..g.
 ...X..e..d..T$P..<.4..HTTP/1.1 200 OK
Date: Tue, 06 Sep 2022 01:00:50 GMT
Content-Type: application/json;charset=utf-8
Content-Length: 71
Server: Jetty(9.4.12.v20180830)

{"code":200,"msg":"ok","rsp":"{\"msg\":\"ok\",\"status\":\"SUCCESS\"}"}
2022-09-06 09:00:50.076413 IP 10.32.142.236.49120 > 192.168.103.136.7000: Flags [.], ack 227, win 60, length 0
E..(.g@.@..+
 ....g....X..T$e..FP..<.W..
2022-09-06 09:01:00.092559 IP 10.32.142.236.49120 > 192.168.103.136.7000: Flags [P.], seq 421:841, ack 227, win 60, length 420
E....h@.@...
 ....g....X..T$e..FP..<....POST / HTTP/1.1
Content-Length: 222
Content-Type: application/json; charset=UTF-8
Host: 192.168.103.136:7000
Connection: Keep-Alive
User-Agent: Apache-HttpAsyncClient/4.1.4 (Java/1.8.0_191)

{"methodName":"feedback","param":"{\"currentLogId\":1242888757,\"handleEndTime\":1662426060089,\"msg\":\"ok\",\"retry\":false,\"status\":\"SUCCESS\"}","parameterType":"com.ggj.platform.task.dc.core.job.model.JobRunResult"}
2022-09-06 09:01:00.094341 IP 192.168.103.136.7000 > 10.32.142.236.49120: Flags [P.], seq 227:453, ack 841, win 62, length 226
E..
.A@.?..o..g.
 ...X..e..F..U.P..>....HTTP/1.1 200 OK
Date: Tue, 06 Sep 2022 01:01:00 GMT
Content-Type: application/json;charset=utf-8
Content-Length: 71
Server: Jetty(9.4.12.v20180830)

{"code":200,"msg":"ok","rsp":"{\"msg\":\"ok\",\"status\":\"SUCCESS\"}"}
2022-09-06 09:01:00.094366 IP 10.32.142.236.49120 > 192.168.103.136.7000: Flags [.], ack 453, win 62, length 0
E..(.i@.@..)
 ....g....X..U.e..(P..>.W..
2022-09-06 09:01:30.094410 IP 192.168.103.136.7000 > 10.32.142.236.49120: Flags [F.], seq 453, ack 841, win 62, length 0
E..(.B@.?..P..g.
 ...X..e..(..U.P..>]s..
2022-09-06 09:01:30.094471 IP 10.32.142.236.49120 > 192.168.103.136.7000: Flags [F.], seq 841, ack 454, win 62, length 0
E..(.j@.@..(
 ....g....X..U.e..)P..>.W..
2022-09-06 09:01:30.094610 IP 192.168.103.136.7000 > 10.32.142.236.49120: Flags [.], ack 842, win 62, length 0
E..(.C@.?..O..g.
 ...X..e..)..U.P..>]r..
2022-09-06 09:01:40.029392 IP 10.32.142.236.50106 > 192.168.103.136.7000: Flags [S], seq 3342558746, win 29200, options [mss 1460,sackOK,TS val 2559673926 ecr 0,nop,wscale 9], length 0
E..<.\@.@.."
 ....g....X.;f.......r..k.........
...F.......	
2022-09-06 09:01:40.029577 IP 192.168.103.136.7000 > 10.32.142.236.50106: Flags [S.], seq 83186263, ack 3342558747, win 29200, options [mss 1460,nop,nop,sackOK,nop,wscale 9], length 0
E..4..@.?.z...g.
 ...X....RW.;f...r................	
2022-09-06 09:01:40.029594 IP 10.32.142.236.50106 > 192.168.103.136.7000: Flags [.], ack 1, win 58, length 0
E..(.]@.@..5
 ....g....X.;f...RXP..:.W..
2022-09-06 09:01:40.029778 IP 10.32.142.236.50106 > 192.168.103.136.7000: Flags [P.], seq 1:421, ack 1, win 58, length 420
E....^@.@...
 ....g....X.;f...RXP..:....POST / HTTP/1.1
Content-Length: 222
Content-Type: application/json; charset=UTF-8
Host: 192.168.103.136:7000
Connection: Keep-Alive
User-Agent: Apache-HttpAsyncClient/4.1.4 (Java/1.8.0_191)

{"methodName":"feedback","param":"{\"currentLogId\":1242889269,\"handleEndTime\":1662426100029,\"msg\":\"ok\",\"retry\":false,\"status\":\"SUCCESS\"}","parameterType":"com.ggj.platform.task.dc.core.job.model.JobRunResult"}
2022-09-06 09:01:40.029912 IP 192.168.103.136.7000 > 10.32.142.236.50106: Flags [.], ack 421, win 60, length 0
E..(..@.?.....g.
 ...X....RX.;g.P..<....
2022-09-06 09:01:40.032940 IP 192.168.103.136.7000 > 10.32.142.236.50106: Flags [P.], seq 1:227, ack 421, win 60, length 226
E..
..@.?.....g.
 ...X....RX.;g.P..<.V..HTTP/1.1 200 OK
Date: Tue, 06 Sep 2022 01:01:40 GMT
Content-Type: application/json;charset=utf-8
Content-Length: 71
Server: Jetty(9.4.12.v20180830)

{"code":200,"msg":"ok","rsp":"{\"msg\":\"ok\",\"status\":\"SUCCESS\"}"}
2022-09-06 09:01:40.032954 IP 10.32.142.236.50106 > 192.168.103.136.7000: Flags [.], ack 227, win 60, length 0
E..(._@.@..3
 ....g....X.;g...S:P..<.W..
2022-09-06 09:02:00.458183 IP 10.32.142.236.50106 > 192.168.103.136.7000: Flags [P.], seq 421:841, ack 227, win 60, length 420
E....`@.@...
 ....g....X.;g...S:P..<....POST / HTTP/1.1
Content-Length: 222
Content-Type: application/json; charset=UTF-8
Host: 192.168.103.136:7000
Connection: Keep-Alive
User-Agent: Apache-HttpAsyncClient/4.1.4 (Java/1.8.0_191)

{"methodName":"feedback","param":"{\"currentLogId\":1242889542,\"handleEndTime\":1662426120454,\"msg\":\"ok\",\"retry\":false,\"status\":\"SUCCESS\"}","parameterType":"com.ggj.platform.task.dc.core.job.model.JobRunResult"}
2022-09-06 09:02:00.460156 IP 192.168.103.136.7000 > 10.32.142.236.50106: Flags [P.], seq 227:453, ack 841, win 62, length 226
E..
..@.?.....g.
 ...X....S:.;icP..>....HTTP/1.1 200 OK
Date: Tue, 06 Sep 2022 01:02:00 GMT
Content-Type: application/json;charset=utf-8
Content-Length: 71
Server: Jetty(9.4.12.v20180830)

{"code":200,"msg":"ok","rsp":"{\"msg\":\"ok\",\"status\":\"SUCCESS\"}"}
2022-09-06 09:02:00.460171 IP 10.32.142.236.50106 > 192.168.103.136.7000: Flags [.], ack 453, win 62, length 0
E..(.a@.@..1
 ....g....X.;ic..T.P..>.W..
2022-09-06 09:02:10.031587 IP 10.32.142.236.43820 > 192.168.103.137.7000: Flags [S], seq 2159676558, win 29200, options [mss 1460,sackOK,TS val 2559703928 ecr 0,nop,wscale 9], length 0
E..<..@.@...
 ....g..,.X..........r..l.........
...x.......	
2022-09-06 09:02:10.031808 IP 192.168.103.137.7000 > 10.32.142.236.43820: Flags [S.], seq 4000066050, ack 2159676559, win 29200, options [mss 1460,nop,nop,sackOK,nop,wscale 9], length 0
E..4..@.?.z...g.
 ...X.,.l*.......r..s.............	
2022-09-06 09:02:10.031829 IP 10.32.142.236.43820 > 192.168.103.137.7000: Flags [.], ack 1, win 58, length 0
E..(..@.@...
 ....g..,.X.....l*.P..:.X..
2022-09-06 09:02:10.032018 IP 10.32.142.236.43820 > 192.168.103.137.7000: Flags [P.], seq 1:421, ack 1, win 58, length 420
E.....@.@...
 ....g..,.X.....l*.P..:....POST / HTTP/1.1
Content-Length: 222
Content-Type: application/json; charset=UTF-8
Host: 192.168.103.137:7000
Connection: Keep-Alive
User-Agent: Apache-HttpAsyncClient/4.1.4 (Java/1.8.0_191)

{"methodName":"feedback","param":"{\"currentLogId\":1242889693,\"handleEndTime\":1662426130031,\"msg\":\"ok\",\"retry\":false,\"status\":\"SUCCESS\"}","parameterType":"com.ggj.platform.task.dc.core.job.model.JobRunResult"}
2022-09-06 09:02:10.032152 IP 192.168.103.137.7000 > 10.32.142.236.43820: Flags [.], ack 421, win 60, length 0
E..(.a@.?..0..g.
 ...X.,.l*....3P..<.x..
2022-09-06 09:02:10.033682 IP 192.168.103.137.7000 > 10.32.142.236.43820: Flags [P.], seq 1:227, ack 421, win 60, length 226
E..
.b@.?..M..g.
 ...X.,.l*....3P..<....HTTP/1.1 200 OK
Date: Tue, 06 Sep 2022 01:02:10 GMT
Content-Type: application/json;charset=utf-8
Content-Length: 71
Server: Jetty(9.4.12.v20180830)

{"code":200,"msg":"ok","rsp":"{\"msg\":\"ok\",\"status\":\"SUCCESS\"}"}
2022-09-06 09:02:10.033694 IP 10.32.142.236.43820 > 192.168.103.137.7000: Flags [.], ack 227, win 60, length 0
E..(..@.@...
 ....g..,.X...3.l*.P..<.X..
2022-09-06 09:02:20.029666 IP 10.32.142.236.43820 > 192.168.103.137.7000: Flags [P.], seq 421:841, ack 227, win 60, length 420
E.....@.@...
 ....g..,.X...3.l*.P..<....POST / HTTP/1.1
Content-Length: 222
Content-Type: application/json; charset=UTF-8
Host: 192.168.103.137:7000
Connection: Keep-Alive
User-Agent: Apache-HttpAsyncClient/4.1.4 (Java/1.8.0_191)

{"methodName":"feedback","param":"{\"currentLogId\":1242889796,\"handleEndTime\":1662426140025,\"msg\":\"ok\",\"retry\":false,\"status\":\"SUCCESS\"}","parameterType":"com.ggj.platform.task.dc.core.job.model.JobRunResult"}
2022-09-06 09:02:20.031648 IP 192.168.103.137.7000 > 10.32.142.236.43820: Flags [P.], seq 227:453, ack 841, win 62, length 226
E..
.c@.?..L..g.
 ...X.,.l*.....P..>.F..HTTP/1.1 200 OK
Date: Tue, 06 Sep 2022 01:02:20 GMT
Content-Type: application/json;charset=utf-8
Content-Length: 71
Server: Jetty(9.4.12.v20180830)

{"code":200,"msg":"ok","rsp":"{\"msg\":\"ok\",\"status\":\"SUCCESS\"}"}
2022-09-06 09:02:20.031663 IP 10.32.142.236.43820 > 192.168.103.137.7000: Flags [.], ack 453, win 62, length 0
E..(..@.@...
 ....g..,.X.....l+.P..>.X..
2022-09-06 09:02:30.063878 IP 10.32.142.236.43820 > 192.168.103.137.7000: Flags [P.], seq 841:1261, ack 453, win 62, length 420
E.....@.@...
 ....g..,.X.....l+.P..>....POST / HTTP/1.1
Content-Length: 222
Content-Type: application/json; charset=UTF-8
Host: 192.168.103.137:7000
Connection: Keep-Alive
User-Agent: Apache-HttpAsyncClient/4.1.4 (Java/1.8.0_191)

{"methodName":"feedback","param":"{\"currentLogId\":1242889903,\"handleEndTime\":1662426150063,\"msg\":\"ok\",\"retry\":false,\"status\":\"SUCCESS\"}","parameterType":"com.ggj.platform.task.dc.core.job.model.JobRunResult"}
2022-09-06 09:02:30.065544 IP 192.168.103.137.7000 > 10.32.142.236.43820: Flags [P.], seq 453:679, ack 1261, win 64, length 226
E..
.d@.?..K..g.
 ...X.,.l+....{P..@....HTTP/1.1 200 OK
Date: Tue, 06 Sep 2022 01:02:30 GMT
Content-Type: application/json;charset=utf-8
Content-Length: 71
Server: Jetty(9.4.12.v20180830)

{"code":200,"msg":"ok","rsp":"{\"msg\":\"ok\",\"status\":\"SUCCESS\"}"}
2022-09-06 09:02:30.065561 IP 10.32.142.236.43820 > 192.168.103.137.7000: Flags [.], ack 679, win 64, length 0
E..(..@.@...
 ....g..,.X...{.l,.P..@.X..
2022-09-06 09:02:30.460052 IP 192.168.103.136.7000 > 10.32.142.236.50106: Flags [F.], seq 453, ack 841, win 62, length 0
E..(..@.?.....g.
 ...X....T..;icP..>....
2022-09-06 09:02:30.460133 IP 10.32.142.236.50106 > 192.168.103.136.7000: Flags [F.], seq 841, ack 454, win 62, length 0
E..(.b@.@..0
 ....g....X.;ic..T.P..>.W..
2022-09-06 09:02:30.460283 IP 192.168.103.136.7000 > 10.32.142.236.50106: Flags [.], ack 842, win 62, length 0
E..(..@.?.....g.
 ...X....T..;idP..>....
2022-09-06 09:02:40.025746 IP 10.32.142.236.51210 > 192.168.103.136.7000: Flags [S], seq 2822446941, win 29200, options [mss 1460,sackOK,TS val 2559733922 ecr 0,nop,wscale 9], length 0
E..<o.@.@.	.
 ....g..
.X.;.]......r..k.........
..p........	
2022-09-06 09:02:40.025972 IP 192.168.103.136.7000 > 10.32.142.236.51210: Flags [S.], seq 1068963714, ack 2822446942, win 29200, options [mss 1460,nop,nop,sackOK,nop,wscale 9], length 0
E..4..@.?.z...g.
 ...X.
?....;.^..r.9|.............	
2022-09-06 09:02:40.025993 IP 10.32.142.236.51210 > 192.168.103.136.7000: Flags [.], ack 1, win 58, length 0
E..(p.@.@.	.
 ....g..
.X.;.^?...P..:.W..
2022-09-06 09:02:40.026191 IP 10.32.142.236.51210 > 192.168.103.136.7000: Flags [P.], seq 1:421, ack 1, win 58, length 420
E...p.@.@...
 ....g..
.X.;.^?...P..:....POST / HTTP/1.1
Content-Length: 222
Content-Type: application/json; charset=UTF-8
Host: 192.168.103.136:7000
Connection: Keep-Alive
User-Agent: Apache-HttpAsyncClient/4.1.4 (Java/1.8.0_191)

{"methodName":"feedback","param":"{\"currentLogId\":1242890026,\"handleEndTime\":1662426160025,\"msg\":\"ok\",\"retry\":false,\"status\":\"SUCCESS\"}","parameterType":"com.ggj.platform.task.dc.core.job.model.JobRunResult"}
2022-09-06 09:02:40.026333 IP 192.168.103.136.7000 > 10.32.142.236.51210: Flags [.], ack 421, win 60, length 0
E..(|a@.?..1..g.
 ...X.
?....;!.P..<....
2022-09-06 09:02:40.027858 IP 192.168.103.136.7000 > 10.32.142.236.51210: Flags [P.], seq 1:227, ack 421, win 60, length 226
E..
|b@.?..N..g.
 ...X.
?....;!.P..<....HTTP/1.1 200 OK
Date: Tue, 06 Sep 2022 01:02:40 GMT
Content-Type: application/json;charset=utf-8
Content-Length: 71
Server: Jetty(9.4.12.v20180830)

{"code":200,"msg":"ok","rsp":"{\"msg\":\"ok\",\"status\":\"SUCCESS\"}"}
2022-09-06 09:02:40.027870 IP 10.32.142.236.51210 > 192.168.103.136.7000: Flags [.], ack 227, win 60, length 0
E..(p.@.@.	.
 ....g..
.X.;!.?..eP..<.W..
2022-09-06 09:03:00.065302 IP 192.168.103.137.7000 > 10.32.142.236.43820: Flags [F.], seq 679, ack 1261, win 64, length 0
E..(.e@.?..,..g.
 ...X.,.l,....{P..@z...
2022-09-06 09:03:00.065372 IP 10.32.142.236.43820 > 192.168.103.137.7000: Flags [F.], seq 1261, ack 680, win 64, length 0
E..(..@.@...
 ....g..,.X...{.l,.P..@.X..
2022-09-06 09:03:00.065509 IP 192.168.103.137.7000 > 10.32.142.236.43820: Flags [.], ack 1262, win 64, length 0
E..(.f@.?..+..g.
 ...X.,.l,....|P..@z...
2022-09-06 09:03:00.098922 IP 10.32.142.236.44780 > 192.168.103.137.7000: Flags [S], seq 2385710293, win 29200, options [mss 1460,sackOK,TS val 2559753995 ecr 0,nop,wscale 9], length 0
E..<..@.@...
 ....g....X.3........r..l.........
...........	
2022-09-06 09:03:00.099111 IP 192.168.103.137.7000 > 10.32.142.236.44780: Flags [S.], seq 3198342932, ack 2385710294, win 29200, options [mss 1460,nop,nop,sackOK,nop,wscale 9], length 0
E..4..@.?.z...g.
 ...X.......3....r.@..............	
2022-09-06 09:03:00.099129 IP 10.32.142.236.44780 > 192.168.103.137.7000: Flags [.], ack 1, win 58, length 0
E..(..@.@...
 ....g....X.3......P..:.X..
2022-09-06 09:03:00.106762 IP 10.32.142.236.44780 > 192.168.103.137.7000: Flags [P.], seq 1:421, ack 1, win 58, length 420
E.....@.@..
 ....g....X.3......P..:....POST / HTTP/1.1
Content-Length: 222
Content-Type: application/json; charset=UTF-8
Host: 192.168.103.137:7000
Connection: Keep-Alive
User-Agent: Apache-HttpAsyncClient/4.1.4 (Java/1.8.0_191)

{"methodName":"feedback","param":"{\"currentLogId\":1242890242,\"handleEndTime\":1662426180098,\"msg\":\"ok\",\"retry\":false,\"status\":\"SUCCESS\"}","parameterType":"com.ggj.platform.task.dc.core.job.model.JobRunResult"}
2022-09-06 09:03:00.106896 IP 192.168.103.137.7000 > 10.32.142.236.44780: Flags [.], ack 421, win 60, length 0
E..(|.@.?.....g.
 ...X.......3.zP..<....
2022-09-06 09:03:00.108541 IP 192.168.103.137.7000 > 10.32.142.236.44780: Flags [P.], seq 1:227, ack 421, win 60, length 226
E..
|.@.?.....g.
 ...X.......3.zP..<....HTTP/1.1 200 OK
Date: Tue, 06 Sep 2022 01:03:00 GMT
Content-Type: application/json;charset=utf-8
Content-Length: 71
Server: Jetty(9.4.12.v20180830)

{"code":200,"msg":"ok","rsp":"{\"msg\":\"ok\",\"status\":\"SUCCESS\"}"}
2022-09-06 09:03:00.108553 IP 10.32.142.236.44780 > 192.168.103.137.7000: Flags [.], ack 227, win 60, length 0
E..(..@.@...
 ....g....X.3.z....P..<.X..
2022-09-06 09:03:10.027438 IP 192.168.103.136.7000 > 10.32.142.236.51210: Flags [F.], seq 227, ack 421, win 60, length 0
E..(|c@.?../..g.
 ...X.
?..e.;!.P..<....
2022-09-06 09:03:10.029635 IP 10.32.142.236.44780 > 192.168.103.137.7000: Flags [P.], seq 421:841, ack 227, win 60, length 420
E.....@.@...
 ....g....X.3.z....P..<....POST / HTTP/1.1
Content-Length: 222
Content-Type: application/json; charset=UTF-8
Host: 192.168.103.137:7000
Connection: Keep-Alive
User-Agent: Apache-HttpAsyncClient/4.1.4 (Java/1.8.0_191)

{"methodName":"feedback","param":"{\"currentLogId\":1242890429,\"handleEndTime\":1662426190025,\"msg\":\"ok\",\"retry\":false,\"status\":\"SUCCESS\"}","parameterType":"com.ggj.platform.task.dc.core.job.model.JobRunResult"}
2022-09-06 09:03:10.029681 IP 10.32.142.236.51210 > 192.168.103.136.7000: Flags [F.], seq 421, ack 228, win 60, length 0
E..(p.@.@.	.
 ....g..
.X.;!.?..fP..<.W..
2022-09-06 09:03:10.029828 IP 192.168.103.136.7000 > 10.32.142.236.51210: Flags [.], ack 422, win 60, length 0
E..(|d@.?.....g.
 ...X.
?..f.;!.P..<....
2022-09-06 09:03:10.031389 IP 192.168.103.137.7000 > 10.32.142.236.44780: Flags [P.], seq 227:453, ack 841, win 62, length 226
E..
|.@.?.....g.
 ...X.......3..P..>.~..HTTP/1.1 200 OK
Date: Tue, 06 Sep 2022 01:03:10 GMT
Content-Type: application/json;charset=utf-8
Content-Length: 71
Server: Jetty(9.4.12.v20180830)

{"code":200,"msg":"ok","rsp":"{\"msg\":\"ok\",\"status\":\"SUCCESS\"}"}
2022-09-06 09:03:10.031406 IP 10.32.142.236.44780 > 192.168.103.137.7000: Flags [.], ack 453, win 62, length 0
E..(..@.@...
 ....g....X.3......P..>.X..
2022-09-06 09:03:30.062041 IP 10.32.142.236.44780 > 192.168.103.137.7000: Flags [P.], seq 841:1261, ack 453, win 62, length 420
E.....@.@..	
 ....g....X.3......P..>....POST / HTTP/1.1
Content-Length: 222
Content-Type: application/json; charset=UTF-8
Host: 192.168.103.137:7000
Connection: Keep-Alive
User-Agent: Apache-HttpAsyncClient/4.1.4 (Java/1.8.0_191)

{"methodName":"feedback","param":"{\"currentLogId\":1242890639,\"handleEndTime\":1662426210061,\"msg\":\"ok\",\"retry\":false,\"status\":\"SUCCESS\"}","parameterType":"com.ggj.platform.task.dc.core.job.model.JobRunResult"}
2022-09-06 09:03:30.063650 IP 192.168.103.137.7000 > 10.32.142.236.44780: Flags [P.], seq 453:679, ack 1261, win 64, length 226
E..
|.@.?.....g.
 ...X.......3..P..@....HTTP/1.1 200 OK
Date: Tue, 06 Sep 2022 01:03:30 GMT
Content-Type: application/json;charset=utf-8
Content-Length: 71
Server: Jetty(9.4.12.v20180830)

{"code":200,"msg":"ok","rsp":"{\"msg\":\"ok\",\"status\":\"SUCCESS\"}"}
2022-09-06 09:03:30.063666 IP 10.32.142.236.44780 > 192.168.103.137.7000: Flags [.], ack 679, win 64, length 0
E..(..@.@...
 ....g....X.3......P..@.X..
2022-09-06 09:04:00.063557 IP 192.168.103.137.7000 > 10.32.142.236.44780: Flags [F.], seq 679, ack 1261, win 64, length 0
E..(|.@.?.....g.
 ...X.......3..P..@....
2022-09-06 09:04:00.063612 IP 10.32.142.236.44780 > 192.168.103.137.7000: Flags [F.], seq 1261, ack 680, win 64, length 0
E..(..@.@...
 ....g....X.3......P..@.X..
2022-09-06 09:04:00.063760 IP 192.168.103.137.7000 > 10.32.142.236.44780: Flags [.], ack 1262, win 64, length 0
E..(|.@.?.....g.
 ...X.......3..P..@....
2022-09-06 09:04:00.093429 IP 10.32.142.236.52910 > 192.168.103.136.7000: Flags [S], seq 3876048169, win 29200, options [mss 1460,sackOK,TS val 2559813990 ecr 0,nop,wscale 9], length 0
E..<dO@.@..0
 ....g....X...)......r..k.........
...f.......	
2022-09-06 09:04:00.093626 IP 192.168.103.136.7000 > 10.32.142.236.52910: Flags [S.], seq 1250581223, ack 3876048170, win 29200, options [mss 1460,nop,nop,sackOK,nop,wscale 9], length 0
E..4..@.?.z...g.
 ...X..J.Z....*..r................	
2022-09-06 09:04:00.093642 IP 10.32.142.236.52910 > 192.168.103.136.7000: Flags [.], ack 1, win 58, length 0
E..(dP@.@..C
 ....g....X...*J.Z.P..:.W..
2022-09-06 09:04:00.093826 IP 10.32.142.236.52910 > 192.168.103.136.7000: Flags [P.], seq 1:421, ack 1, win 58, length 420
E...dQ@.@...
 ....g....X...*J.Z.P..:....POST / HTTP/1.1
Content-Length: 222
Content-Type: application/json; charset=UTF-8
Host: 192.168.103.136:7000
Connection: Keep-Alive
User-Agent: Apache-HttpAsyncClient/4.1.4 (Java/1.8.0_191)

{"methodName":"feedback","param":"{\"currentLogId\":1242890978,\"handleEndTime\":1662426240093,\"msg\":\"ok\",\"retry\":false,\"status\":\"SUCCESS\"}","parameterType":"com.ggj.platform.task.dc.core.job.model.JobRunResult"}
2022-09-06 09:04:00.093985 IP 192.168.103.136.7000 > 10.32.142.236.52910: Flags [.], ack 421, win 60, length 0
E..(.M@.?.|E..g.
 ...X..J.Z.....P..<....
2022-09-06 09:04:00.095702 IP 192.168.103.136.7000 > 10.32.142.236.52910: Flags [P.], seq 1:227, ack 421, win 60, length 226
E..
.N@.?.{b..g.
 ...X..J.Z.....P..<.a..HTTP/1.1 200 OK
Date: Tue, 06 Sep 2022 01:04:00 GMT
Content-Type: application/json;charset=utf-8
Content-Length: 71
Server: Jetty(9.4.12.v20180830)

{"code":200,"msg":"ok","rsp":"{\"msg\":\"ok\",\"status\":\"SUCCESS\"}"}
2022-09-06 09:04:00.095715 IP 10.32.142.236.52910 > 192.168.103.136.7000: Flags [.], ack 227, win 60, length 0
E..(dR@.@..A
 ....g....X....J.[.P..<.W..
2022-09-06 09:04:00.363051 IP 10.32.142.236.46082 > 192.168.103.137.7000: Flags [S], seq 1082609862, win 29200, options [mss 1460,sackOK,TS val 2559814259 ecr 0,nop,wscale 9], length 0
E..<..@.@.~.
 ....g....X@.P.......r..l.........
...s.......	
2022-09-06 09:04:00.363245 IP 192.168.103.137.7000 > 10.32.142.236.46082: Flags [S.], seq 3019128924, ack 1082609863, win 29200, options [mss 1460,nop,nop,sackOK,nop,wscale 9], length 0
E..4..@.?.z...g.
 ...X....@\@.P...r................	
2022-09-06 09:04:00.363260 IP 10.32.142.236.46082 > 192.168.103.137.7000: Flags [.], ack 1, win 58, length 0
E..(..@.@.~.
 ....g....X@.P...@]P..:.X..
